title,year,Id,Category
Phylogeography of the diamond turbot (Hypsopsetta guttulata) across the Baja California Peninsula,2010,436,"Behavior,Genetic,Habitat,Spatial,Fish,Sm,"
Population dynamics and genetic differentiation in the bivalve mollusc Abra tenuis: aplanic dispersal,2004,437,"Genetic,Misc,Oceanography,Spatial,Invertebrate,Sm,"
Restricted gene flow and evolutionary divergence between geographically separated populations of the Antarctic octopus Pareledone turqueti,1997,438,"Genetic,Habitat,Spatial,Invertebrate,Sm,"
"GEOGRAPHIC-VARIATION AMONG 3 ISOLATED POPULATIONS OF THE HADAL AMPHIPOD HIRONDELLEA GIGAS (CRUSTACEA, AMPHIPODA, LYSIANASSOIDEA)",1993,439,"Deep_sea,Genetic,Habitat,Spatial,Invertebrate,Sm,"
Long current to nowhere? - Genetic connectivity of Jasus tristani populations in the southern Atlantic Ocean,2007,440,"Deep_sea,Genetic,Oceanography,Spatial,Historical,Bg,Invertebrate,"
"Habitat discontinuities form strong barriers to gene flow among mangrove populations, despite the capacity for long-distance dispersal",2019,441,"Genetic,Habitat,Spatial,Algae,Sm,"
Population genetic structure of the Antarctic ascidian Aplidium falklandicum from Scotia Arc and South Shetland Islands,2010,442,"Genetic,Habitat,Larval_duration,Misc,Oceanography,Spatial,Invertebrate,Sm,"
Baja California disjunctions and phylogeographic patterns in sympatric California blennies,2014,443,"Genetic,Habitat,Spatial,Historical,Fish,GSpatial,Sm,"
"A reassessment of the distribution of the common Antarctic scallop Adamussium colbecki (Smith, 1902)",2006,444,"Genetic,Habitat,Larval_duration,Spatial,Invertebrate,Sm,"
Assessment of genetic diversity of seagrass populations using DNA fingerprinting: Implications for population stability and management,1994,445,"Genetic,Habitat,Spatial,Algae,Sm,"
"A taxonomic, phylogenetic and biogeographic study of the genus Acanthophora (Rhodomelaceae, Rhodophyta)",1999,446,"Genetic,Spatial,Historical,Algae,Bg,"
Scallop Genetics and Genomics,2016,447,"Genetic,Habitat,Oceanography,Spatial,Invertebrate,Sm,Selection_incompatibility,"
"Limited realized dispersal and introgressive hybridization influence genetic structure and conservation strategies for brown rockfish, Sebastes auriculatus",2005,448,"Behavior,Genetic,Larval_duration,Oceanography,Spatial,Historical,Fish,Sm,"
A Seascape Genetics Approach to Studying Genetic Differentiation in the Bull Kelp Nereocystis luetkeana,2019,449,"Genetic,Habitat,Oceanography,Historical,Algae,Sm,"
Evolutionary and biogeographical patterns within the smelt genus Hypomesus in the North Pacific Ocean,2007,450,"Genetic,Spatial,Historical,Bg,Fish,"
Origins and Present Distribution of Fishes in Japan,2022,451,"Genetic,Oceanography,Spatial,Historical,Fish,Sm,"
Comparative phylogeography of the ocean planet,2016,452,"Genetic,Habitat,Oceanography,Spatial,Historical,Bg,Multiple,"
Two distinct mtDNA lineages of the blue crab reveal large-scale population structure in its native Atlantic distribution,2017,453,"Genetic,Invasive,Spatial,Invertebrate,Sm,"
"Genetic differentiation between spatially-disjunct populations of the deep-sea, hydrothermal vent-endemic amphipod Ventiella sulfuris",1992,454,"Deep_sea,Genetic,Habitat,Spatial,Historical,Invertebrate,Sm,"
"""Nested"" cryptic diversity in a widespread marine ecosystem engineer: a challenge for detecting biological invasions",2011,455,"Genetic,Invasive,Misc,Spatial,Invertebrate,Sm,"
Genetic Differentiation of Disjunct Gulf of California and Pacific Outer Coast Populations of Hypsoblennius jenkinsi,1987,456,"Genetic,Spatial,Historical,Fish,Sm,Selection_incompatibility,"
Marine biogeographic disjunction in central New Zealand,2005,457,"Genetic,Larval_duration,Oceanography,Spatial,Invertebrate,Sm,"
Disparate patterns of population genetic structure and population history in two sympatric penaeid shrimp species ( <i>Farfantepenaeus aztecus</i> and <i>Litopenaeus setiferus</i> ) in the eastern United States,2003,458,"Genetic,Habitat,Spatial,Historical,Invertebrate,Sm,"
"PHYLOGEOGRAPHY AND DEMOGRAPHY OF SYMPATRIC SISTER SURFPERCH SPECIES, EMBIOTOCA JACKSONI AND E. LATERALIS ALONG THE CALIFORNIA COAST: HISTORICAL VERSUS ECOLOGICAL FACTORS",2005,459,"Competition,Genetic,Spatial,Historical,Fish,Sm,"
Effect of the East Siberian barrier on the echinoderm dispersal in the Arctic Ocean,2010,460,"Habitat,Oceanography,Spatial,Historical,Invertebrate,Sm,Selection_incompatibility,"
Divergence genetics analysis reveals historical population genetic processes leading to contrasting phylogeographic patterns in co-distributed species,2010,461,"Genetic,Historical,Invertebrate,Sm,"
"Comparative phylogeography of a bathymetrically segregated pair of sister taxa of rockfishes (genus Sebastes): black rockfish, Sebastes melanops, and yellowtail rockfish, Sebastes flavidus",2023,462,"Genetic, Sm, Historical, Oceanography,Fish, "
"A genetic basis for geographic variation in shell morphology in the bay scallop, Argopecten irradians",1997,463,"Invertebrate, Sm, Spatial, Unknown, "
Impact of individual early life traits in larval dispersal: A multispecies approach using backtracking models,2021,464,"Sm, Fish, Larval_duration, Oceanography, "