title,year,Id,Category
Climate hindcasts: exploring the disjunct distribution of Diopatra biscayensis,2016,294,"Invasive,Spatial,Invertebrate,Sm,"
Small-scale genetic structure of Cerastoderma glaucum in a lagoonal environment: potential significance of habitat discontinuity and unstable population dynamics,2013,295,"Genetic,Habitat,Invertebrate,Sm,"
"Genetic diversity hotspot of the amphi-Pacific macroalga Gloiopeltis furcatasensulato (Gigartinales, Florideophyceae)",2020,296,"Genetic,Habitat,Algae,Sm,"
Few and far apart: integrative taxonomy of Australian species of Gladiobela and Pagodibela (Conoidea : Raphitomidae) reveals patterns of wide distributions and low abundance,2021,297,"Deep_sea,Effort,Habitat,Spatial,Invertebrate,Sm,"
THE MARINE EAST-INDIES - CENTER OF ORIGIN,1992,298,"Misc,Multiple,nogap,"
Latitudinal patterns in abundance and life-history traits of the mole crab Emerita brasiliensis on South American sandy beaches,2004,299,"Habitat,Spatial,Temperature,Invertebrate,Sm,"
The connectivity of Mytilus galloprovincialis in northern Morocco: A gene flow crossroads between continents,2015,300,"Genetic,Oceanography,Invertebrate,Sm, "
"New record of Lithodidae (Crustacea Decapoda, Anomura) from the Antarctic (Bellingshausen Sea)",2005,301,"Effort,Spatial,Climate_change,Invertebrate,Sm,"
"Introduced or glacial relict? Phylogeography of the cryptogenic tunicate Molgula manhattensis (Ascidiacea, Pleurogona)",2011,302,"Genetic,Invasive,Spatial,Bg,Invertebrate,"
"Oceanic dispersal barriers, adaptation and larval retention: an interdisciplinary assessment of potential factors maintaining a phylogeographic break between sister lineages of an African prawn",2008,303,"Genetic,Larval_duration,Oceanography,Temperature,Invertebrate,Sm,"
Galaxias maculatus: An explanation of its biogeography,1996,304,"Larval_duration,Oceanography,Spatial,Bg,Fish,"
"Phylogeographic structuring of the amphidromous shrimp Atya scabra (Crustacea, Decapoda, Atyidae) unveiled by range-wide mitochondrial DNA sampling",2019,305,"Genetic,Larval_duration,Oceanography,Spatial,Historical,Bg,Invertebrate,"
"Discontinuous distribution of Alepisaurus ferox Lowe, 1833 (Alepisauridae, Teleostei) in the Indian EEZ as revealed by the tuna longline survey",2010,306,"Spatial,Fish,Oxygen,Sm,"
Genetic diversity and population structure in two species of sea cucumber: differing patterns according to mode of development,1998,307,"Genetic,Larval_duration,Oceanography,Historical,Invertebrate,Sm,"
"Tethyan relicts on continental coastlines of the northwestern Pacific Ocean and Australasia: molecular phylogeny and fossil record of batillariid gastropods (Caenogastropoda, Cerithioidea)",2009,308,"Genetic,Spatial,Historical,Bg,Invertebrate,"
Evolutionary history of the seagrass genus Posidonia,2011,309,"Genetic,Spatial,Historical,Algae,Bg,"
Environmental factors influencing the distribution of southern right whales (Eubalaena australis) on the south coast of South Africa I: Broad scale patterns,2004,310,"Behavior,Habitat,Spatial,Mammal,Sm,"
"Integrative taxonomy of the Felimare californiensis and F. ghiselini species complex (Nudibranchia: Chromodorididae), with description of a new species from Peru",2017,311,"Spatial,Historical,Bg,Invertebrate,"
Biogeography of Alaskan seaweeds,2006,312,"Spatial,Historical,Algae,Sm,"
"The supergiant amphipod Alicella gigantea (Crustacea: Alicellidae) from hadal depths in the Kermadec Trench, SW Pacific Ocean",2013,313,"Deep_sea,Effort,Spatial,Bg,GSpatial,Invertebrate,"
Phylogeny of cardiid bivalves (cockles and giant clams): revision of the Cardiinae and the importance of fossils in explaining disjunct biogeographical distributions,2002,314,"Effort,Spatial,Bg,Invertebrate,"
"On the identity of Prodelphinus petersii Lutken, 1889 and records of dusky dolphin Lagenorhynchus obscurus (Gray, 1828) from the southern Indian and Atlantic oceans",1995,315,"Unknown,Spatial,Bg,Mammal,"
Mitochondrial DNA sequence analysis from multiple gene fragments reveals genetic heterogeneity of Crassostrea ariakensis in East Asia,2014,316,"Genetic,Historical,Invertebrate,Sm,"
Phylogenetic relationships of crown conchs (Melongena spp.): the corona complex simplified,2009,317,"Unknown,GSpatial,Invertebrate,Sm,"
Repeated trans-Arctic invasions in littoral bivalves: molecular zoogeography of the Macoma balthica complex,2003,318,"Genetic,Spatial,Historical,Bg,Invertebrate,"
Comparative phylogeography of reef fishes from the Gulf of Aden to the Arabian Sea reveals two cryptic lineages,2017,319,"Genetic,Oceanography,Temperature,Historical,Fish,Sm,"
"Introduced and native Phlebobranch and Stolidobranch solitary ascidians (Tunicata: Ascidiacea) around Salvador, Bahia, Brazil",2012,320,"Invasive,Spatial,Bg,Invertebrate,"
"EARLY-LIFE HISTORIES, OCEAN CURRENTS, AND THE POPULATION-GENETICS OF CARIBBEAN REEF FISHES",1995,321,"Unknown,Larval_duration,Oceanography,Spatial,Historical,Fish,Sm,"
"First record of Hydrolagus melanophasma James, Ebert, Long & Didier, 2009 (Chondrichthyes, Chimaeriformes, Holocephali) from the southeastern Pacific Ocean",2012,322,"Unknown,Spatial,Fish,Sm,"
Competition between hardwood hammocks and mangroves,2007,323,"Oceanography,Spatial,Algae,Sm,Salinity,"
"Evidence of large, local variations in recruitment and mortality in the small giant clam, Tridacna maxima, at Ningaloo Marine Park, Western Australia",2011,324,"Unknown,Habitat,Larval_duration,Misc,Spatial,Invertebrate,Sm,"
Genetic relationships of Mytilus galloprovincialis Lamarck populations worldwide: evidence from nuclear-DNA markers,2000,325,"Genetic,Invasive,Spatial,Bg,Invertebrate,"
Phylogeography of New Zealand's coastal benthos,2009,326,"Community,Genetic,Larval_duration,Oceanography,Benthic,Sm,"
Microsatellite variation in ringed seals (Phoca hispida): genetic structure and history of the Baltic Sea population,2001,327,"Spatial,Historical,GSpatial,Mammal,Sm,"
"Genetic affinities and biogeography of putative Levantine-endemic seaweed Treptacantha rayssiae (Ramon) M.Mulas, J.Neiva & A.Israel, comb. nov. (Phaeophyceae)",2020,328,"Effort,Spatial,Algae,Sm,"
TRACKING DISPERSAL ROUTES - PHYLOGEOGRAPHY OF THE ARCTIC ANTARCTIC DISJUNCT SEAWEED ACROSIPHONIA-ARCTA (CHLOROPHYTA),1994,329,"Genetic,Misc,Spatial,Historical,Algae,Bg,"
A first account of the semi-endophytic coralline algae Lithophyllum cuneatum from the Caribbean Sea and its evolutionary and biogeographic significance,2022,330,"Spatial,Historical,Algae,Bg,"
"A new species of Asterodiscides (Echinodermata, Asteroidea, Asterodiscididae) from the tropical southwest Pacific, and the biogeography of the genus revisited",2009,331,"Effort,Spatial,Invertebrate,Sm,"
"Assessing effects of genetic, environmental, and biotic gradients in species distribution modelling",2019,332,"Competition,Habitat,Spatial,Temperature,Invertebrate,Sm,"
A tropical/subtropical biogeographic disjunction in southeastern Africa separates two evolutionarily significant units of an estuarine prawn,2009,333,"Genetic,Habitat,Larval_duration,Oceanography,Temperature,Invertebrate,Sm,"
Avoiding current oversights in marine reserve design,2003,334,"Behavior,Larval_duration,Oceanography,Spatial,Multiple,Sm,"
Barcoding of arrow worms (Phylum Chaetognatha) from three oceans: Genetic diversity and evolution within an enigmatic phylum,2010,335,"Unknown,Genetic,Spatial,Bg,Invertebrate,"
Applying landscape metrics to species distribution model predictions to characterize internal range structure and associated changes,2023,336,"Competition,Habitat,Oceanography,Spatial,Climate_change,Multiple,Sm,"
"Assessment of genetic and phenotypic diversity of the giant kelp, Macrocystis pyrifera, to support breeding programs",2018,337,"Genetic,Habitat,Algae,Sm,"
Across-shelf distribution of blue mussel larvae in the northern Gulf of Maine: consequences for population connectivity and a species range boundary,2015,338,"Genetic,Larval_duration,Oceanography,Invertebrate,Sm,"
"Another dolphin in peril? Photo-identification, occurrence, and distribution of the endangered Indian Ocean humpback dolphin (Sousa plumbea) in Algoa Bay",2018,339,"Unknown,Spatial,Mammal,Sm,"
"Asymmetric oceanographic processes mediate connectivity and population genetic structure, as revealed by RADseq, in a highly dispersive marine invertebrate (Parastichopus californicus)",2018,340,"Genetic,Larval_duration,Oceanography,Invertebrate,Sm,"
"Alien amphipods in a sea of troubles: cryptogenic species, unresolved taxonomy and overlooked introductions",2017,341,"Invasive,Spatial,Bg,Invertebrate,"
"Affinities of the family Sollasellidae (Porifera, Demospongiae). I. Morphological evidence",2006,342,"Unknown,Spatial,Bg,Invertebrate,"
"A new species of Nezumia (Gadiformes : Macrouridae) from Fieberling Guyot, eastern North Pacific Ocean",2001,343,"Spatial,Historical,Bg,Fish,"
Areas of endemism in the Southwestern Atlantic Ocean based on the distribution of benthic hydroids (Cnidaria: Hydrozoa),2015,344,"Habitat,Oceanography,Spatial,Temperature,Historical,Invertebrate,Sm,"
Asymmetric dispersal of southern bull-kelp (Durvillaea antarctica) adults in coastal New Zealand: testing an oceanographic hypothesis,2010,345,"Unknown,Genetic,Habitat,Oceanography,Algae,Sm,"
"A comparative study of populations of Ectopleura crocea and Ectopleura ralphi (Hydrozoa, Tubulariidae) from the Southwestern Atlantic Ocean",2014,346,"Invasive,Spatial,Bg,GSpatial,Invertebrate,"
Vicariance Biogeography,2001,347,"Misc,Spatial,Historical,Multiple,Bg,"
The trans-Pacific zipper effect: disjunct sister taxa and matching geological outlines that link the Pacific margins: The trans-Pacific zipper effect,2003,348,"Spatial,Historical,Bg,Multiple,"
Global mitochondrial DNA phylogeography and biogeographic history of the antitropically and longitudinally disjunct marine bryozoan Membranipora membranacea L. (Cheilostomata): Another cryptic marine sibling species complex?,2008,349,"Genetic,Oceanography,Spatial,Temperature,Historical,Bg,Invertebrate,"
Convergent evolution of ecomorphological adaptations in geographically isolated Bay gobies (Teleostei: Gobionellidae) of the temperate North Pacific,2014,350,"Genetic,Spatial,Historical,Bg,Fish,"
The Pacific palaeogeography of Rhizophora mangle L. (Rhizophoraceae),1991,351,"Genetic,Larval_duration,Spatial,Historical,Algae,Bg,"
Glacial vicariance drives phylogeographic diversification in the amphi-boreal kelp Saccharina latissima,2018,352,"Genetic,Spatial,Historical,Algae,Bg,"
Genetic diversity and differentiation among high-latitude broadcast-spawning coral populations disjunct from the core range,2013,353,"Unknown,Genetic,Larval_duration,Oceanography,Spatial,Bg,Invertebrate,"
Out-of-the tropics or trans-tropical dispersal? The origins of the disjunct distribution of the gooseneck barnacle Pollicipes elegans,2015,354,"Habitat,Oceanography,Temperature,Historical,Bg,Invertebrate,Spatial,"
Does the recruitment of a non-native mussel in native eelgrass habitat explain their disjunct adult distributions?: Juvenile non-native mussels in eelgrass,2005,355,"Behavior,Community,Competition,Invasive,Spatial,Invertebrate,Sm,"
Temperature ecotypes and biogeography of Acrosiphoniales (Chlorophyta) with Arctic-Antarctic disjunct and Arctic/cold-temperature distributions,1995,356,"Spatial,Temperature,Historical,Bg,Plankton,"
"Status, morphology, and phylogenetic relationships of <i>Iyengaria</i> (Scytosiphonaceae, Phaeophyceae), a brown algal genus with a disjunct distribution in the Indian Ocean",2020,357,"Unknown,Genetic,Spatial,Algae,Bg,"
Distinguishing between dispersal and vicariance: A novel approach using anti‐tropical taxa across the fish Tree of Life,2021,358,"Genetic,Habitat,Spatial,Historical,Bg,Fish,"
TEMPERATURE RESPONSES OF DISJUNCT TEMPERATE BROWN ALGAE INDICATE LONG-DISTANCE DISPERSAL OF MICROTHALLI ACROSS THE TROPICS1,1992,359,"Spatial,Temperature,Historical,Algae,Bg,"
Range expansion and complete mitochondrial genome of the highfin blenny (Lupinoblennius nicholsi),2022,360,"Effort,Spatial,Sm,"
Genetic patterns in peripheral marine populations of the fusilier fish <i>Caesio cuning</i> within the Kuroshio Current,2018,361,"Genetic,Habitat,Larval_duration,Oceanography,Fish,Sm,Selection_incompatibility,"
Conservation priorities for peripheral species: the example of British Columbia,2004,362,"Spatial,Climate_change,Multiple,Sm,"
Arctic-Antarctic disjunctions in the benthic seaweeds Acrosiphonia arcta (Chlorophyta) and Desmarestia viridis/willii (Phaeophyta) are of recent origin,1993,363,"Genetic,Misc,Spatial,Historical,Algae,Bg,"
"Ribosomal DNA shows extremely low genetic divergence in a world-wide distributed, but disjunct and highly adapted marine protozoan (Virgulinella fragilis, Foraminiferida)",2009,364,"Unknown,Misc,Spatial,Historical,Bg,GSpatial,Plankton,"
Beyond area relationships: Extinction and recolonization in molecular marine biogeography,1998,365,"Genetic,Habitat,Historical,Multiple,Sm,Selection_incompatibility,"
Rafting dispersal in a brooding southern sea star (Asteroidea : Anasterias),2018,366,"Genetic,Oceanography,R,Spatial,Invertebrate,Sm,"
"Incipient speciation of Catostylus mosaicus (Scyphozoa, Rhizostomeae, Catostylidae), comparative phylogeography and biogeography in south-east Australia",2005,367,"Genetic,Spatial,Temperature,Historical,Invertebrate,Sm,"
Molecular phylogeography reveals multiple Pleistocene divergence events in estuarine crabs from the tropical West Pacific,2022,368,"Genetic,Oceanography,Spatial,Historical,Invertebrate,Sm,"
Discordant distribution of populations and genetic variation in a sea star with high dispersal potential,2009,369,"Unknown,Genetic,Oceanography,Spatial,Historical,Invertebrate,Sm,"
"Mapping aquatic faunal exchanges across the Sunda shelf, South-East Asia, using distributional and genetic data sets from the cyprinid fish Barbodes gonionotus (Bleeker, 1850)",2004,370,"Genetic,Spatial,Historical,Fish,Sm,"
Delineating management units for Pacific cod (Gadus macrocephalus) in the Sea of Japan,2019,371,"Genetic,Habitat,Larval_duration,Oceanography,Temperature,Historical,Fish,Sm,"
Population genetic structure of Patagonian toothfish (Dissostichus eleginoides) in the Southeast Pacific and Southwest Atlantic Ocean,2018,372,"Deep_sea,Genetic,Habitat,Larval_duration,Spatial,Fish,Sm,"
Phylogeography of the planktonic chaetognath Sagitta setosa reveals isolation in European seas,2004,373,"Genetic,Habitat,Spatial,Historical,Sm,Mobile_plankton,"
Thermal selection as a driver of marine ecological speciation,2019,374,"Genetic,Temperature,Fish,Sm,"
Phylogeography in coastal marine animals: A solution from California?,2001,375,"Genetic,Habitat,Larval_duration,Oceanography,Spatial,Historical,Multiple,Sm,"
DNA taxonomy confirms the identity of the widely-disjunct mediterranean and atlantic populations of the tufted ghost crab ocypode cursor (Crustacea: Decapoda: Ocypodidae),2019,376,"Spatial,Historical,Climate_change,GSpatial,Invertebrate,Sm,"
Highly restricted gene flow between disjunct populations of the skunk clownfish (Amphiprion akallopisos) in the Indian Ocean,2017,377,"Genetic,Habitat,Larval_duration,Spatial,Historical,Bg,Fish,"
Genetic diversity and restricted genetic connectivity in an endangered marine fish (Brachionichthys hirsutus) provides a model for conservation management in related and data-deficient species,2021,378,"Behavior,Genetic,Habitat,Spatial,Fish,Sm,"
Comparative population genetics and demographic history of two polychaete species suggest that coastal lagoon populations evolve under alternate regimes of gene flow,2018,379,"Genetic,Habitat,Larval_duration,Spatial,Historical,Invertebrate,Oxygen,Sm,"
Phylogeographic heterogeneity of the brown macroalga Sargassum horneri (Fucaceae) in the northwestern Pacific in relation to late Pleistocene glaciation and tectonic configurations,2011,380,"Genetic,Oceanography,Spatial,Historical,Algae,Sm,"
Distribution and habitat characteristics of dolphins of the genus Stenella (Cetacea: Delphinidae) in the southwest Atlantic Ocean,2005,381,"Behavior,Habitat,Oceanography,Spatial,Temperature,Mammal,Sm,"
Evaluating connectivity in the brooding brittle star Astrotoma agassizii across the drake passage in the Southern Ocean,2008,382,"Genetic,Habitat,Larval_duration,Oceanography,Spatial,Invertebrate,Sm,"
"Phylogeography and cryptic introduction of the ragworm Hediste diversicolor (Annelida, Nereididae) in the Northwest Atlantic",2014,383,"Genetic,Invasive,Spatial,Invertebrate,Sm,"
"An integrated ecological, genetic and geological assessment of long-distance dispersal by invertebrates on kelp rafts",2018,384,"Genetic,Oceanography,R,Spatial,Multiple,Sm,"
A biogeographical perspective of the deep-sea hydrothermal vent fauna,1998,385,"Unknown,Deep_sea,Genetic,Spatial,Historical,Multiple,Sm,"
Genetic similarity of disjunct populations of the giant sea bass Stereolepis gigas,2007,386,"Spatial,Historical,Fish,GSpatial,Sm,"
"The marine otter Lontra felina (Molina, 1782): A review of its present status and implications for future conservation",2012,387,"Unknown,Genetic,Habitat,Spatial,Mammal,Sm,"
"Genetic divergence of peripherally disjunct populations of the gastropod Batillariella estuarina in the Houtman Abrolhos Islands, Western Australia",2001,388,"Genetic,Habitat,Larval_duration,Spatial,Invertebrate,Sm,"
Limited success of the non-indigenous bivalve clam Rangia cuneata in the Lithuanian coastal waters of the Baltic Sea and the Curonian Lagoon,2019,389,"Invasive,Spatial,GSpatial,Invertebrate,Sm,"
"Inland-water calanoid copepods of Kangaroo, King and Flinders Islands: Biogeography and ecology",1996,390,"Spatial,Historical,Sm,Mobile_plankton,"
Geographic range limitation of the intertidal gastropods Littorina sitkana and L. planaxis,1976,391,"Competition,Habitat,Larval_duration,Oceanography,Spatial,Invertebrate,Sm,"
Temperature Ecotypes in Seaweeds: Adaptive Significance and Biogeographic Implications,1994,392,"Genetic,Spatial,Temperature,Historical,Algae,Sm,"
Evolutionary and biogeographical patterns of barnacles from deep-sea hydrothermal vents,2015,393,"Deep_sea,Genetic,Spatial,Historical,Invertebrate,Sm,"
Evolution and paleobiogeography of mangroves,2019,394,"Genetic,Habitat,Spatial,Historical,Algae,Bg,"
Benthic biome of the southern ocean: Present state of knowledge and future perspectives,2022,395,"Community,Genetic,Spatial,Temperature,Historical,Benthic,Sm,"
The evolutionary history of the goby Elacatinus puncticulatus in the tropical eastern pacific: Effects of habitat discontinuities and local environmental variability,2019,396,"Genetic,Habitat,Oceanography,Spatial,Historical,Fish,Sm,"
"Disjunct Sea of Cortez-pacific ocean Gillichthys mirabilis populations and the evolutionary origin of their Sea of Cortez endemic relative, Gillichthys seta",2001,397,"Genetic,Spatial,Historical,Fish,Sm,"
Genetic structure of Patagonian toothfish populations from otolith DNA,2016,398,"Unknown,Behavior,Genetic,Spatial,Fish,Sm,"
"Taxonomic Status of the Okhotsk Lumpsucker Eumicrotremus ochotonensis (Cyclopteridae, Cottoidei) with Redescription of E. derjugini",2019,399,"Unknown,Genetic,Spatial,Fish,Sm,"
"Todaropsis eblanae, lesser flying squid",2013,400,"Unknown,Genetic,Spatial,Invertebrate,Sm,"
Unexpected mosaic distribution of two hybridizing sibling lineages in the teleplanically dispersing snail Stramonita haemastoma suggests unusual postglacial redistribution or cryptic invasion,2017,401,"Genetic,Invasive,Spatial,Invertebrate,Sm,Selection_incompatibility,"
"Oysters of the Conch Republic (Florida Keys): A molecular phylogenetic study of Parahyotissa mcgintyi, Teskeyostrea weberi and Ostreola equestris",2004,402,"Spatial,Historical,GSpatial,Invertebrate,Sm,"
Origin of Macquarie Island echinoderms,1998,403,"Genetic,Habitat,Larval_duration,Spatial,Historical,Invertebrate,Sm,"
Factors influencing biogeographic patterns of Australasian centropagid copepods,1991,404,"Genetic,Spatial,Historical,Bg,Mobile_plankton,"
Tempo and mode of speciation in the Baja California disjunct fish species Anisotremus davidsonii,2005,405,"Genetic,Habitat,Spatial,Historical,Fish,Sm,"
Composition and biogeography of hydrothermal vent communities in western pacific back-arc basins,2006,406,"Unknown,Community,Deep_sea,Genetic,Oceanography,Spatial,Historical,Benthic,Sm,"
Phylogeographical disjunction in abundant high-dispersal littoral gastropods,2005,407,"Unknown,Genetic,Habitat,Spatial,Historical,Invertebrate,Sm,"
A suggested physical explanation for the existence of a biological boundary at 24°30′S in the Benguela system,1988,408,"Community,Larval_duration,Oceanography,Spatial,Fish,Sm,"
Phylogeny and biogeography of pholadid bivalve Barnea (Anchomasa) with considerations on the phylogeny of Pholadoidea,2009,409,"Genetic,Spatial,Historical,Bg,Invertebrate,"
The dynamics and geographic disjunction of the kelp Eisenia arborea along the west coast of Canada,2021,410,"Competition,Spatial,Historical,Climate_change,Algae,Sm,"
"Hydrothermal-vent alvinellid polychaete dispersal in the eastern pacific. 1. Influence of vent site distribution, bottom currents, and biological patterns",1997,411,"Unknown,Deep_sea,Genetic,Larval_duration,Oceanography,Spatial,Historical,Invertebrate,Sm,"
THE RELEVANCE OF PASSIVE DISPERSAL FOR THE BIOGEOGRAPHY OF CARIBBEAN MOLLUSKS,1995,412,"Larval_duration,R,Spatial,Historical,GSpatial,Invertebrate,Sm,"
Consequences of marine barriers for genetic diversity of the coral-specialist yellowbar angelfish from the Northwestern Indian Ocean,2019,413,"Genetic,Habitat,Oceanography,Spatial,Fish,Sm,"
"Population and seascape genomics of a critically endangered benthic elasmobranch, the blue skate Dipturus batis",2022,414,"Genetic,Habitat,Spatial,Climate_change,Fish,Sm,"
Testing comparative phylogeographic models of marine vicariance and dispersal using a hierarchical Bayesian approach,2008,415,"Community,Genetic,Spatial,Historical,Multiple,Sm,"
Population structure and genetic variation of lane snapper (Lutjanus synagris) in the northern Gulf of Mexico,2009,416,"Unknown,Genetic,Spatial,Fish,Sm,"
"Phylogeography of the spotted sand bass, Paralabrax maculatofasciatus: Divergence of Gulf of California and Pacific Coast populations",2001,417,"Genetic,Larval_duration,Spatial,Historical,Fish,Sm,"
"Contrasting Genetic Structure and Diversity of Galaxias maculatus (Jenyns, 1848) Along the Chilean Coast: Stock Identification for Fishery Management",2015,418,"Unknown,Genetic,Habitat,Oceanography,Spatial,Historical,Fish,Sm,"
Molecular phylogeny and historical biogeography of Nacella (Patellogastropoda: Nacellidae) in the Southern Ocean,2010,419,"Genetic,Larval_duration,R,Spatial,Historical,Bg,Invertebrate,Sm,"
Nonrandom larval dispersal can steepen marine clines,2005,420,"Genetic,Habitat,Larval_duration,Oceanography,Spatial,Multiple,Sm,"
"Restricted gene flow and incipient speciation in disjunct Pacific Ocean and Sea of Cortez populations of a reef fish species, Girella nigricans",2000,421,"Unknown,Genetic,Spatial,Historical,Fish,Sm,"
"Morphology and molecules on opposite sides of the diversity gradient: Four cryptic species of the Cliona celata (Porifera, Demospongiae) complex in South America revealed by mitochondrial and nuclear markers",2012,422,"Unknown,Genetic,Spatial,Invertebrate,Sm,"
Seagrass Connectivity on the West Coast of Africa Supports the Hypothesis of Grazer-Mediated Seed Dispersal,2022,423,"Competition,Genetic,Spatial,Algae,Sm,"
"Climate-driven genetic divergence of limpets with different life histories across a southeast African marine biogeographic disjunction: different processes, same outcome",2011,424,"Genetic,Habitat,Larval_duration,Oceanography,Historical,Invertebrate,Sm,Selection_incompatibility,"
What Maintains the Central North Pacific Genetic Discontinuity in Pacific Herring?,2012,425,"Behavior,Competition,Genetic,Historical,Fish,Sm,Selection_incompatibility,"
"King crabs of the western Atlantic sector of Antarctic and adjacent areas: new records, molecular barcode data and distribution (Crustacea: Decapoda: Lithodidae)",2015,426,"Deep_sea,Genetic,Habitat,Oceanography,Spatial,Historical,Invertebrate,Sm,"
A MULTILOCUS ALLOZYME DISCONTINUITY IN THE MUSSEL MYTILUS-GALLOPROVINCIALIS - THE INTERACTION OF ECOLOGICAL AND LIFE-HISTORY FACTORS,1995,427,"Competition,Genetic,Oceanography,Spatial,Invertebrate,Sm,"
"Stirred but not shaken: population and recruitment genetics of the scallop (Pecten fumatus) in Bass Strait, Australia",2016,428,"Genetic,Oceanography,Spatial,Invertebrate,Sm,"
Unexpected genetic structure of mussel populations in South Africa: indigenous Perna perna and invasive Mytilus galloprovincialis,2007,429,"Genetic,Larval_duration,Oceanography,Spatial,Invertebrate,Sm,Selection_incompatibility,"
Phylogenetic divergence and population genetics of the hydrothermal vent annelid genus Hesiolyra along the East Pacific Rise: Reappraisal using multi-locus data,2023,430,"Deep_sea,Genetic,Habitat,Spatial,Historical,Bg,Invertebrate,"
"Population genetic structure of the milkfish, Chanos chanos, based on PCR-RFLP analysis of the mitochondrial control region",2004,431,"Behavior,Genetic,Oceanography,Fish,Sm,"
"Twisted sister species of pygmy angelfishes: discordance between taxonomy, coloration, and phylogenetics",2012,432,"Unknown,Genetic,Historical,Fish,Sm,Selection_incompatibility,"
Microsatellite variation in the Mexican rockfish Sebastes macdonaldi,2003,433,"Unknown,Genetic,Spatial,Bg,Fish,"
Vicariance and dispersal across Baja California in disjunct marine fish populations,2003,434,"Genetic,Habitat,Larval_duration,Spatial,Historical,Fish,GSpatial,Sm,"
Genetic connectivity of the ecosystem engineer Perumytilus purpuratus north to the 32A degrees S southeast Pacific ecological discontinuity,2013,435,"Genetic,Larval_duration,Oceanography,Spatial,Invertebrate,Sm,Selection_incompatibility,"
