title,year,Id,Category
"Oceanic currents, not land masses, maintain the genetic structure of the mangrove Rhizophora mucronata Lam. (Rhizophoraceae) in Southeast Asia",2014,1,"Genetic,Oceanography,Algae,Sm,"
The origin of biogeographic segregation in the copper shark (carcharhinus brachyurus): An integ rati ve reconst ruction based on neontological and paleontological data,2020,2,"Behavior,Genetic,Spatial,Historical,Bg,Fish,"
Spatial and temporal patterns of genetic variation in the widespread antitropical deep-sea coral Paragorgia arborea,2012,3,"Deep_sea,Genetic,Spatial,Historical,Bg,Invertebrate,"
The biogeography of some marine planktonic diatoms,1976,4,"Habitat,Oceanography,Spatial,Bg,Plankton,"
Variation in palaeo-shorelines explains contemporary population genetic patterns of rocky shore species,2014,5,"Genetic,Oceanography,Historical,Fish,Sm,"
The role of ancestral seascape discontinuity and geographical distance in structuring rockfish populations in the Pacific Northwest,2022,6,"Genetic,Habitat,Oceanography,Historical,Fish,Sm,"
Temperature or transport? Range limits in marine species mediated solely by flow,2000,7,"Larval_duration,Oceanography,Spatial,Benthic,Sm,"
Biogeographical patterns of rocky shore community structure in south-east Australia: Effects of oceanographic conditions and heat stress,2015,8,"Community,Habitat,Misc,Oceanography,Benthic,Sm,"
Mitochondrial DNA and bindin gene sequence evolution among allopatric species of the sea urchin genus Arbacia,1998,9,"Genetic,Spatial,Bg,Invertebrate,Selection_incompatibility,"
"New species of Caelorinchus (Macrouridae, Gadiformes, Teleostei) from the Indian Ocean",1999,10,"Unknown,Spatial,Bg,Fish,"
"Genetic structure of Atlantic and Gulf of Mexico populations of sea bass, menhaden, and sturgeon: Influence of zoogeographic factors and life-history patterns",1990,11,"Behavior,Genetic,Habitat,Larval_duration,Historical,Fish,Sm,"
Habitat continuity and stepping-stone oceanographic distances explain population genetic connectivity of the brown alga Cystoseira amentacea,2017,12,"Genetic,Habitat,Larval_duration,Oceanography,Spatial,Algae,Sm,"
"A barrier to gene flow in the Asian paddle crab, Charybdis japonica, in the Yellow Sea",2015,13,"Genetic,Oceanography,Historical,Invertebrate,Sm,"
"Molecular evidence of distinct evolutionary units in the sandhopper Talorchestia capensis (Amphipoda, Talitridae) along South African coasts",2016,14,"Genetic,Larval_duration,Temperature,Invertebrate,Sm,"
Genetically separate populations of the ocean-skater Halobates sericeus (Heteroptera: Gerridae) have been maintained since the late Pleistocene,2012,15,"Genetic,Spatial,Temperature,Historical,Bg,Other,"
"Multiple ice-age refugia in Pacific cod, Gadus macrocephalus",2010,16,"Genetic,Historical,Bg,Fish,"
"Evidence for panmixia despite barriers to gene flow in the hooked mussel, Ischadium recurvum (Mytilidae; Brachidontinae) along the North American coastline",2019,17,"Misc,Invertebrate,nogap,"
Molecular insights into the population structures of cosmopolitan marine fishes,1998,18,"Spatial,Historical,Bg,Fish,GSpatial,"
Stepping stones to isolation: Impacts of a changing climate on the connectivity of fragmented fish populations,2018,19,"Genetic,Larval_duration,Oceanography,Spatial,Climate_change,Fish,Sm,"
First record of Ulva californica in the mainland of China: a single alien parthenogenetic population in discontinuous distribution,2022,20,"Invasive,Larval_duration,Spatial,Algae,GSpatial,Sm,"
Return of the ghosts of dispersal past: Historical spread and contemporary gene flow in the blue sea star Linckia laevigata,2014,21,"Genetic,Historical,Invertebrate,Sm,"
Population structure and speciation in tropical seas: Global phylogeography of the sea urchin Diadema,2001,22,"Genetic,Oceanography,Historical,Bg,Invertebrate,"
Global phylogeography of the scalloped hammerhead shark (Sphyrna lewini),2006,23,"Genetic,Habitat,Oceanography,Historical,Bg,Fish,"
Contrast across a boundary: Differing histories of two eelpout populations on a continuous continental slope,2020,24,"Genetic,Habitat,Historical,Fish,Sm,"
"Why are most aquatic plants widely distributed? Dispersal, clonal growth and small-scale heterogeneity in a stressful environment",2002,25,"Larval_duration,Misc,Spatial,Algae,GSpatial,Sm,Selection_incompatibility,"
"Towards a review of the decapod crustacea from the remote oceanic archipelago of Trindade and Martin Vaz, south Atlantic Ocean: New records and notes on ecology and zoogeography",2017,26,"Spatial,Bg,Invertebrate,"
Population subdivision promoted by a sea-level-change-driven bottleneck: A glimpse from the evolutionary history of the mangrove plant Aegiceras corniculatum,2022,27,"Genetic,Habitat,Larval_duration,Oceanography,Spatial,Historical,Algae,Sm,"
Oceanographic drivers of population differentiation in Indo-Pacific bottlenose (Tursiops aduncus) and humpback (Sousa spp.) dolphins of the northern Bay of Bengal,2017,28,"Genetic,Oceanography,Spatial,Mammal,Sm,"
Phylogeography of the bivalve Tegillarca granosa in coastal China: Implications for management and conservation,2012,29,"Genetic,Invasive,Historical,Invertebrate,Sm,"
Retention around and long-distance dispersal between oceanic islands by planktonic larvae of benthic gastropod Mollusca,1996,30,"Larval_duration,Oceanography,Spatial,Bg,Invertebrate,"
Contrasting effects of historical sea level rise and contemporary ocean currents on regional gene flow of rhizophora racemosa in eastern atlantic mangroves,2016,31,"Genetic,Oceanography,Historical,Algae,Sm,"
Vicariance and dispersal effects on phylogeographic structure and speciation in a widespread estuarine invertebrate,2006,32,"Genetic,Oceanography,Historical,Invertebrate,Sm,"
"Genetic divergence in antitropical pelagic marine fishes (Trachurus, Merluccius, and Scomber) between North and South America",1996,33,"Genetic,Spatial,Temperature,Bg,Fish,"
Plankton of the Red Sea and the Arabian Gulf,1984,34,"Unknown,Community,Oceanography,Sm,Plankton,"
Coastal vegetation of Oman,1999,35,"Unknown,Spatial,Algae,Sm,"
Disjunct distribution of highly diverged mitochondrial lineage clade and population subdivision in a marine bivalve with pelagic larval dispersal,2003,36,"Unknown,Genetic,Historical,Invertebrate,Sm,"
13. Geographical Distribution,1998,37,"Oceanography,Spatial,Bg,Invertebrate,"
New Geographical Record for the Two Lesser Known Flatfishes from the North-Eastern Arabian Sea,2022,38,"Effort,Spatial,Fish,Sm,"
"Population structure of the dusky pipefish (Syngnathus floridae) from the Atlantic and Gulf of Mexico, as revealed by mitochondrial DNA and microsatellite analyses",2010,39,"Habitat,Larval_duration,Spatial,Genetic, Historical,Fish,Sm,"
Comparative phylogeography of coastal limpets across a marine disjunction in New Zealand,2006,40,"Genetic,Larval_duration,Oceanography,Historical,Invertebrate,Sm,"
Biological structure of the Pacific Ocean as compared with two other oceans,1981,41,"Community,Habitat,Misc,Bg,Plankton,"
Geographical variation in sound production in the anemonefish Amphiprion akallopisos,2005,42,"Behavior,Spatial,Fish,Sm,"
"Hydrodynamic connectivity of habitats of deep-water corals in Corsair Canyon, Northwest Atlantic: A case for cross-boundary conservation",2019,43,"Deep_sea,Oceanography,Spatial,Invertebrate,Sm,"
Recruitment of deep-water corals and sponges in the Northwest Atlantic Ocean: implications for habitat distribution and population connectivity,2022,44,"Deep_sea,Misc,Oceanography,Spatial,Invertebrate,Sm,"
Oceanic anoxic events and allopatric speciation in the deep sea,1987,45,"Deep_sea,Spatial,Historical,Bg,Multiple,Oxygen,"
Marine biogeographical structure in two highly dispersive gastropods: Implications for trans-Tasman dispersal,2007,46,"Genetic,Habitat,Spatial,Historical,Invertebrate,Sm,"
"First record of the genus Vetulina Schmidt, 1879 (Porifera: Demospongiae: Sphaerocladina) from the Indian Ocean with the description of two new species: biogeographic and evolutionary significance",2018,47,"Spatial,Historical,Bg,Invertebrate,"
Global population genetic structure and biogeography of the oceanic copepods Eucalanus hyalinus and E. spinifer,2005,48,"Genetic,Habitat,Oceanography,Spatial,Bg,Mobile_plankton,"
"Two new species of Pseudojuloides from Western Australia and Southern Japan, with a redescription of pseudojuloides elongatus (Teleostei: Labridae)",2020,49,"Unknown,Genetic,Spatial,Bg,Fish,"
Inter-ocean dispersal is an important mechanism in the zoogeography of hakes (Pisces: Merluccius spp.),2001,50,"Unknown,Genetic,Oceanography,Spatial,Historical,Bg,Fish,"
Phylogeography of the sandy beach amphipod Haustorioides japonicus along the Sea of Japan: Paleogeographical signatures of cryptic regional divergences,2018,51,"Genetic,Historical,Invertebrate,Sm,"
Limited phylogeographic structure for five bathyal ophiuroids at continental scales,2014,52,"Unknown,Genetic,Larval_duration,Invertebrate,Sm,"
"Development and characterization of microsatellite markers for the finetooth shark, Carcharhinus isodon",2012,53,"Unknown,Spatial,Fish,Sm,"
"A new genus of Chthamalidae (Cirripedia, Balanomorpha) from the Red Sea and Indian Ocean",1967,54,"Unknown,Spatial,Historical,Invertebrate,Sm,"
Major genetic differences between crown-of-thorns starfish (Acanthaster planci) populations in the Indian and Pacific oceans,1999,55,"Genetic,Historical,Invertebrate,Sm,"
The influence of oceanographic fronts and early-life-history traits on connectivity among littoral fish species,2009,56,"Genetic,Oceanography,Fish,Sm,"
Spatial distribution and life-history aspects of blackspot seabream Pagellus bogaraveo (Osteichthyes: Sparidae),2013,57,"Habitat,Spatial,Fish,Sm,"
"Identifying patterns of dispersal, connectivity and selection in the sea scallop, Placopecten magellanicus, using RADseq-derived SNPs",2017,58,"Unknown,Genetic,Oceanography,Invertebrate,Sm,"
New record for the deep-sea genus Tripoplax (Mollusca: Polyplacophora) in the eastern Pacific,2016,59,"Deep_sea,Effort,Spatial,Bg,Invertebrate,Oxygen,"
Phylogeography of the copper shark (Carcharhinus brachyurus) in the southern hemisphere: Implications for the conservation of a coastal apex predator,2011,60,"Genetic,Historical,Bg,Fish,"
The first record of palaemon macrodactylus (oriental shrimp) from the eastern coast of North America,2010,61,"Invasive,Spatial,Bg,Invertebrate,"
"Cladophoropsis brachyartra from southern South America is a synonym of Wittrockiella lyallii (Cladophorophyceae, Chlorophyta), previously regarded as endemic to New Zealand",2010,62,"Habitat,Spatial,Temperature,Historical,Algae,Bg,"
Genetic structuring across marine biogeographic boundaries in rocky shore invertebrates,2014,63,"Community,Genetic,Oceanography,Historical,Invertebrate,Sm,"
"Mangrove forests of timor-leste: Ecology, degradation and vulnerability to climate change",2014,64,"Habitat,Spatial,Climate_change,Algae,Sm,"
Is life history a barrier to dispersal? Contrasting patterns of genetic differentiation along an oceanographically complex coast,2008,65,"Genetic,Larval_duration,Invertebrate,Sm,"
"Rediscovery and redescription of the smoothtooth blacktip shark, Carcharhinus leiodon (Carcharhinidae), from Kuwait, with notes on its possible conservation status",2011,66,"Unknown,Spatial,Bg,Fish,"
Disjunct distributions of Halobates (Hemiptera: Gerridae) in the Pacific Ocean,1997,67,"Oceanography,Spatial,Bg,Other,"
"Genetic population structure of sheepshead, Archosargus probatocephalus (Sparidae), a coastal marine fish off the southeastern United States: Multiple population clusters based on species-specific microsatellite markers",2017,68,"Unknown,Genetic,Habitat,Historical,Fish,Sm,"
"Biogeography and natural history of sphaeroma walkeri stebbing (Crustacea: Isopoda) and its introduction to san diego bay, California",1981,69,"Invasive,Spatial,Bg,Invertebrate,"
Biochemical genetics of the sea anemone Bunodosoma cavernata and the zoogeography of the Gulf of Mexico,1982,70,"Genetic,Oceanography,Historical,Invertebrate,Sm,"
"Historic divergence with contemporary connectivity in a catadromous fish, the estuary perch (Macquaria colonorum)",2011,71,"Genetic,Oceanography,Historical,Fish,Sm,"
Ocean currents influence the genetic structure of an intertidal mollusc in southeastern Australia - implications for predicting the movement of passive dispersers across a marine biogeographic barrier,2013,72,"Genetic,Oceanography,Historical,Invertebrate,Sm,"
Phylogeography and species distribution modelling reveal the effects of the Pleistocene ice ages on an intertidal limpet from the south-eastern Pacific,2018,73,"Genetic,Habitat,Historical,Invertebrate,Sm,"
Boomeranging around Australia: Historical biogeography and population genomics of the anti-equatorial fish Microcanthus strigatus (Teleostei: Microcanthidae),2019,74,"Genetic,Spatial,Historical,Bg,Fish,"
Discontinuité hydrobiologique dans le détroit du Pas-de-Calais,1987,75,"Community,Sm,Plankton,"
The marine algae of Hluleka (Transkei) and the warm temperate/sub-tropical transition on the east coast of southern Africa,1987,76,"Spatial,Temperature,Algae,Sm,"
"The effects of depth, distance, and the Mid-Atlantic Ridge on genetic differentiation of abyssal and hadal isopods (Macrostylidae)",2018,77,"Deep_sea,Genetic,Habitat,Misc,Spatial,Historical,Invertebrate,Sm,"
Habitat discontinuities separate genetically divergent populations of a rocky shore marine fish,2016,78,"Genetic,Habitat,Fish,Sm,"
"Evidence of a biogeographic break between populations of a high dispersal starfish: Congruent regions within the Indo-West Pacific defined by color morphs, mtDNA, and allozyme data",1998,79,"Genetic,Oceanography,Historical,Bg,Invertebrate,"
Structure and biogeography of hydrothermal vent communities,2010,80,"Unknown,Community,Deep_sea,Habitat,Historical,Multiple,Sm,"
Rapid expansion and facilitating factors of the Ponto-Caspian invader dikerogammarus villosus within the Eastern Baltic sea,2019,81,"Habitat,Invasive,Spatial,Invertebrate,Sm,"
"Redescription of Echinoderes ohtsukai Yamasaki and Kajihara, 2012 and E. kozloffi Higgins, 1977 from the northeastern Pacific coast, including the first report of a potential invasive species of kinorhynch",2016,82,"Invasive,Spatial,Bg,GSpatial,Invertebrate,"
Genetic subdivision of Australian and New Zealand populations of Jasus verreauxi (Decapoda: Palinuridae)—preliminary evidence from the mitochondrial genome,1992,83,"Genetic,Oceanography,Spatial,Bg,Invertebrate,"
"Deep genetic subdivision within a continuously distributed and highly vagile marine mammal, the Steller's sea lion (Eumetopias jubatus)",2006,84,"Behavior,Genetic,Historical,Mammal,Sm,"
Extinction and replacement in the Indo-West Pacific Ocean,1999,85,"Competition,Genetic,Spatial,Historical,Bg,Multiple,"
"Decoupling of short- and long-distance dispersal pathways in the endemic New Zealand seaweed Carpophyllum maschalocarpum (Phaeophyceae, Fucales)",2012,86,"Genetic,Habitat,Larval_duration,Oceanography,Historical,Algae,Sm,"
Population genetic differentiation of the hydrothermal vent crab Austinograea alayseae (Crustacea: Bythograeidae) in the southwest Pacific Ocean,2019,87,"Deep_sea,Genetic,Oceanography,Historical,Invertebrate,Sm,"
Comparative phylogeography of three codistributed stomatopods: Origins and timing of regional lineage diversification in the Coral Triangle,2006,88,"Genetic,Oceanography,Historical,Invertebrate,Sm,"
Evolutionary history of the reef fish Anisotremus interruptus (Perciformes: Haemulidae) throughout the Tropical Eastern Pacific,2021,89,"Genetic,Habitat,Spatial,Historical,Fish,Sm,"
Life histories in an epifaunal community: coupling of adult and larval processes,1992,90,"Community,Larval_duration,Oceanography,Spatial,Invertebrate,Sm,"
Contemporary habitat discontinuity and historic glacial ice drive genetic divergence in Chilean kelp,2010,91,"Genetic,Habitat,R,Historical,Algae,Sm,"
Population genetic structure of chub mackerel Scomber japonicus in the Northwestern Pacific inferred from microsatellite analysis,2015,92,"Behavior,Genetic,Larval_duration,Spatial,Fish,Sm,"
Fisheries genomics of snapper (Chrysophrys auratus) along the west Australian coast,2022,93,"Genetic,Larval_duration,Oceanography,Fish,Sm,"
Mitonuclear discordance in genetic structure across the Atlantic/Indian Ocean biogeographical transition zone,2014,94,"Effort,Genetic,Multiple,Sm,"
Comparative phylogeography of black mangroves (Avicennia germinans) and red mangroves (Rhizophora mangle) in Florida: Testing the maritime discontinuity in coastal plants,2016,95,"Genetic,Historical,Algae,Sm,Selection_incompatibility,"
Distribución geográfica y depredación de Porites lobata (Anthozoa: Scleractinia) en la costa occidental de México,1999,96,"Misc,Oceanography,Spatial,Invertebrate,Sm,"
Corals and coral reefs of the Pacific coast of Colombia,2003,97,"Community,Habitat,Oceanography,Spatial,Historical,Invertebrate,Sm,"
Plankton patchiness in the Polar Front region of the west Spitsbergen Shelf,2016,98,"Community,Habitat,Misc,Sm,Plankton,"
"Genetic conspecificity of the worldwide populations of Didemnum vexillum Kott, 2002",2009,99,"Invasive,Spatial,Bg,GSpatial,Invertebrate,"
Biological traits explain the distribution and colonisation ability of the invasive shore crab Hemigrapsus takanoi,2014,100,"Invasive,Spatial,Invertebrate,Sm,"
"First insight of genetic diversity, phylogeographic relationships, and population structure of marine sponge Chondrosia reniformis from the eastern and western Mediterranean coasts of Tunisia",2022,101,"Genetic,Larval_duration,Oceanography,Invertebrate,Sm,"
"Littoral tanaidaceans (Crustacea: Peracarida) from Guerrero and Oaxaca, Mexico",2010,102,"Effort,Spatial,Invertebrate,Sm,"
"Review of the history of the deep-sea ostracod genera Abyssocythere Benson and Dutoitella Dingle, and their responses to Cretaceous – Cenozoic oceanic water-mass changes",2022,103,"Deep_sea,Genetic,Spatial,Historical,Bg,Invertebrate,"
"Specific niche requirements underpin multidecadal range edge stability, but may introduce barriers for climate change adaptation",2021,104,"Habitat,Misc,Oceanography,Spatial,Climate_change,Invertebrate,Sm,"
Biogeographical patterns of rocky intertidal communities along the Pacific coast of North America,2008,105,"Community,Habitat,Oceanography,Temperature,Benthic,Sm,"
"Progress, problems and patterns in the biogeography of reef corals and other tropical marine organisms",1988,106,"Misc,nogap,"
Phylogeography of seaweeds in the south east pacific: Complex evolutionary processes along a latitudinal gradient,2016,107,"Genetic,Larval_duration,Oceanography,Historical,Algae,Sm,"
Antitropical Distribution and Evolution in the Indo-West Pacific Ocean,1987,108,"Competition,Spatial,Historical,Bg,Multiple,"
Experimental interbreeding between geographically separated populations of the marine wood-boring isopod Limnoria tripunctata with preliminary indications of hybrid vigor,1972,109,"Unknown,Spatial,Bg,Invertebrate,"
Taxonomy and biogeography of the fiddler crabs (Ocypodidae: Genus Uca) of the Atlantic and Gulf coasts of eastern North America,1984,110,"Habitat,Spatial,Temperature,Historical,Invertebrate,Sm,"
"Genetic variation of Littorina horikawai endemic to the western coast and the adjacent islands around Kyushu, Japan inferred by mtDNA analyses",2022,111,"Genetic,Habitat,Larval_duration,Invertebrate,Sm,"
Spatial variation in subtidal plant communities around the Socotra Archipelago and their biogeographic affinities within the Indian Ocean,2003,112,"Unknown,Oceanography,Spatial,Historical,Algae,Sm,"
"Biogeography of Adeonella ( Bryozoa, Cheilostomata): a preliminary account.",1983,113,"Unknown,Spatial,Historical,Bg,Invertebrate,"
A new species of Trochita ( Gastropoda: Calyptraeidae) from Oman: a relict distribution and association with upwelling areas.,1985,114,"Spatial,Historical,Bg,Invertebrate,"
Marine dispersal as a pre-requisite for Gondwanan vicariance among elements of the galaxiid fish fauna,2012,115,"Genetic,Spatial,Historical,Bg,Fish,"
Bloom dynamics of toxic Alexandrium species in the northeastern U.S.,1997,116,"Community,Habitat,Oceanography,Sm,Plankton,"
"Rissoina indiscreta, a new rissoid species from the tropical southwestern Atlantic with Indo-West Pacific affinities (Mollusca, Gastropoda, Rissooidea)",1989,117,"Spatial,Historical,Bg,Invertebrate,"
The genetic architecture of hybridisation between two lineages of greenshell mussels,2015,118,"Genetic,Historical,Invertebrate,Sm,Selection_incompatibility,"
Aspects of mangal ecology along the red sea coast of saudi arabia,1987,119,"Unknown,Spatial,Algae,Sm,"
"Contrasting gene flow at different spatial scales revealed by genotyping- by-sequencing in Isocladus armatus, a massively colour polymorphic New Zealand marine isopod",2018,120,"Genetic,Oceanography,Invertebrate,Sm,"
"Chapter 9 Marine patterns, Part I",1995,121,"Genetic,Spatial,Multiple,nogap,"
Mitochondrial DNA variation reveals a sharp genetic break within the distribution of the blue land crab cardisoma guanhumi in the Western Central Atlantic,2015,122,"Unknown,Genetic,Bg,Invertebrate,"
A new species and new records of marine algae from chile,1989,123,"Invasive,Larval_duration,Spatial,Algae,Sm,"
Small-scale spatial and seasonal differences in the distribution of beach arthropods on the northwestern Tunisian coast. Are species evenly distributed along the shore?,2002,124,"Community,Habitat,Misc,Spatial,Invertebrate,Sm,"
Mangrove biogeography: the role of Quaternary environmental and sea- level change,1991,125,"Spatial,Historical,Algae,Bg,"
"Distribution of dominant copepods in the Nansen Basin, Arctic Ocean, in summer",1992,126,"Community,Oceanography,Spatial,Sm,Mobile_plankton,"
Habitat availability and geographic isolation as potential drivers of population structure in an oceanic dolphin in the Southwest Indian Ocean,2016,127,"Behavior,Genetic,Habitat,Mammal,Sm,"
Thin layers of bioluminescent copepods found at density discontinuities in the water column,1999,128,"Community,Oceanography,Sm,Mobile_plankton,"
Effects of isolation by distance and geographical discontinuity on genetic subdivision of Littoraria cingulata,1998,129,"Genetic,Habitat,Misc,Invertebrate,Sm,Salinity,"
"First discovery – and a new species – of coelogynopora (Platyhelminthes, proseriata) in the southern hemisphere",2021,130,"Unknown,Spatial,Bg,Invertebrate,"
Influence of Grain Size on Burrowing and Alongshore Distribution of the Yellow Clam (Amarilladesma mactroides),2015,131,"Behavior,Habitat,Spatial,Invertebrate,Sm,"
Taxonomic Status and Geographic Variation of the Marine Enchytraeid Genus Grania Southern (Oligochaeta),1976,132,"Unknown,Spatial,Bg,Invertebrate,"
Comparative analysis of the pattern of population genetic diversity in three Indo-West Pacific Rhizophora mangrove species,2016,133,"Genetic,Habitat,Historical,Climate_change,Algae,Sm,"
"Historical and contemporary range expansion of an invasive mussel, Semimytlius algosus, in Angola and Namibia despite data scarcity in an infrequently surveyed region",2020,134,"Invasive,Spatial,Invertebrate,Sm,"
Spatial pattern of genetic and morphological diversity in the direct developer Acanthina monodon (Gastropoda: Mollusca),2011,135,"Genetic,Habitat,Larval_duration,Historical,Invertebrate,Sm,"
Recent brachiopods from the Persian gulf and their biogeographical significance,2008,136,"Spatial,Historical,Sm,Invertebrate,"
"Vertical, lateral and temporal structure in larval distributions at hydrothermal vents",2005,137,"Community,Deep_sea,Larval_duration,Oceanography,Invertebrate,Sm,"
"New records and redescription of Halcurias pilatus and Halcurias mcmurrichi (Actiniaria, Endocoelantheae)",2013,138,"Effort,Spatial,Bg,Invertebrate,"
"Occurrence of the Atlantic spotted dolphin, Stenella frontalis, in southern Abrolhos Bank, Brazil",2013,139,"Unknown,Spatial,Mammal,Sm,"
Metabarcoding reveals high-resolution biogeographical and metaphylogeographical patterns through marine barriers,2023,140,"Community,Genetic,Oceanography,Multiple,Sm,"
Stage-specific distribution of barnacle larvae in nearshore waters: Potential for limited dispersal and high mortality rates,2007,141,"Behavior,Community,Larval_duration,Oceanography,Spatial,Invertebrate,Sm,"
Macro- and micro-geographic variation in pantophysin (PanI) allele frequencies in NE Atlantic cod Gadus morhua,2005,142,"Genetic,Habitat,Temperature,Fish,Sm,Salinity,"
On the biogeography of the southwest Atlantic with special reference to the sea anemones (Coelenterata: Actiniaria),1986,143,"Oceanography,Spatial,Invertebrate,Sm,"
Mitochondrial DNA diversity in fishes and its implications for introductions,1991,144,"Genetic,Habitat,Historical,Fish,Sm,"
"Mangroves of Colombia revisited in an era of open data, global changes, and socio-political transition: Homage to Heliodoro Sánchez-Páez",2019,145,"Unknown,Misc,Spatial,Algae,Sm,"
Phenological Patterns of Northern New England Seaweeds,1989,146,"Community,Oceanography,Spatial,Temperature,Historical,Algae,Sm,"
The reef ichthyofauna of Bahrain ( Arabian Gulf) with comments on its zoogeographic affinities.,1987,147,"Unknown,Spatial,Fish,Sm,"
When gaps really are gaps: Statistical phylogeography of hydrothermal vent invertebrates,2010,148,"Deep_sea,Effort,Misc,Spatial,Invertebrate,Sm,"
"DNA sequencing reveals three new species of Chamberlainium (Corallinales, Rhodophyta) from South Africa, all formerly passing under Spongites yendoi",2021,149,"Unknown,Spatial,Algae,Sm,"
Progression and Dispersal of an Introduced Alga: Codium Fragile Ssp. Tomentosoides (Chlorophyta) on the Atlantic Coast of North America,1985,150,"Invasive,Spatial,Algae,Bg,"
