title,year,Id,Category
"Molecular phylogeography and evolutionary history of the estuarine copepod, Acartia tonsa, on the Northwest Atlantic coast",2004,151,"Genetic,Historical,Sm,Mobile_plankton,"
"The systematics of the amphidromous shrimp Macrobrachium americanum Spence Bate, 1868 (Decapoda: Caridea: Palaemonidae) from the Mexican Pacific slope",2021,152,"Unknown,Spatial,GSpatial,Invertebrate,Sm,"
Shallow-Water Coral Communities Support the Separation of Marine Ecoregions on the West-Central Florida Gulf Coast,2020,153,"Community,Habitat,Invertebrate,Sm,"
"Phylogeography of a marine insular endemic in the Atlantic Macaronesia: The Azorean barnacle, Megabalanus azoricus (Pilsbry, 1916)",2015,154,"Genetic,Habitat,Larval_duration,Oceanography,Historical,Invertebrate,Sm,"
Marine Phytogeography of the Benguela Upwelling Region on the West Coast of Southern Africa: A Temperature Dependent Approach1,1986,155,"Community,Oceanography,Spatial,Temperature,Algae,Sm,"
"Long-range dispersal and high-latitude environments influence the population structure of a ""stress-tolerant"" dinoflagellate endosymbiont",2013,156,"Genetic,Misc,Other,Sm,Selection_incompatibility,"
"Redescription of Zonophryxus quinquedens Barnard, 1913 (Crustacea, Isopoda, Dajidae) from the Weddell Sea, Antarctica, with notes on its biology and zoogeography",1994,157,"Unknown,Larval_duration,Spatial,Bg,Invertebrate,"
Hybridization between the blue mussels Mytilus galloprovincialis and M. trossulus along the Pacific coast of North America: Evidence for limited introgression,1999,158,"Genetic,Oceanography,Invertebrate,Sm,"
"Morphological variability, spatial distribution and abundance of Helicostomella species (Ciliophora: Tintinnina) in relation to environmental factors (Argentine shelf; 40-55°S)",2009,159,"Unknown,Habitat,Spatial,Invertebrate,Sm,"
Phylogeographic pattern of Rhizophora (Rhizophoraceae) reveals the importance of both vicariance and long-distance oceanic dispersal to modern mangrove distribution,2014,160,"Genetic,Spatial,Historical,Algae,Bg,"
The Bassian Isthmus and the major ocean currents of southeast Australia influence the phylogeography and population structure of a southern Australian intertidal barnacle Catomerus polymerus (Darwin),2008,161,"Genetic,Habitat,Larval_duration,Oceanography,Historical,Invertebrate,Sm,"
Relationships between the presence of ostreopsis (dinophyceae) in the atlantic coast of the Iberian Peninsula and sea-surface temperature,2012,162,"Spatial,Temperature,Sm,Plankton,"
Evidence of small-scale spatial structuring of phytoplankton alpha- and beta-diversity in the open ocean,2016,163,"Community,Oceanography,Sm,Plankton,"
Ecology of the deep-sea benthos,1969,164,"Community,Deep_sea,Habitat,Misc,Benthic,Sm,"
The trans-Pacific spread of equatorial shallow-marine benthos in the Cretaceous,1988,165,"Spatial,Historical,Benthic,Bg,"
Genetic discontinuity associated with an environmentally induced barrier to gene exchange in the marine snail Littorina saxatilis,2008,166,"Community,Genetic,Habitat,Oceanography,Invertebrate,Sm,"
Evolutionary genetics of the Mytilus edulis complex in the North Atlantic region,1988,167,"Unknown,Genetic,Spatial,GSpatial,Invertebrate,Sm,Selection_incompatibility,"
"Molecular evidence of cryptic speciation in the ""cosmopolitan"" excavating sponge Cliona celata (Porifera, Clionaidae)",2010,168,"Unknown,Genetic,Spatial,Invertebrate,Sm,"
"The Marine Algae of the American Coast between Cape May, New Jersey, and Cape Hatteras, North Carolina) II. The Chlorophycophyta",1974,169,"Effort,Spatial,Algae,Sm,"
“A cleaner break”: Genetic divergence between geographic groups and sympatric phenotypes revealed in ballan wrasse (Labrus bergylta),2020,170,"Genetic,Habitat,Larval_duration,Fish,Sm,"
Ecology and zoogeography of deep-reef fishes in northeastern Brazil,2005,171,"Unknown,Deep_sea,Effort,Spatial,Bg,Fish,"
Pinpointing genetic breaks in the southeastern Pacific: Phylogeography and genetic structure of a commercially important tunicate,2021,172,"Genetic,Habitat,Invasive,Oceanography,Invertebrate,Sm,"
Tropical transpacific shore fishes,2004,173,"Deep_sea,Larval_duration,Oceanography,Spatial,Bg,Fish,"
The point on Opaliopsis atlantis (Gastropoda: Epitoniidae) distribution: New data from the Mediterranean and implications,2020,174,"Deep_sea,Larval_duration,Spatial,Bg,Invertebrate,"
Intertidal population genetic dynamics at a microgeographic seascape scale,2013,175,"Genetic,Habitat,Misc,Algae,Sm,Selection_incompatibility,"
"Genetic population structure of minke whales Balaenoptera acutorostrata from Greenland, the North East Atlantic and the North Sea probably reflects different ecological regions",2003,176,"Competition,Habitat,Oceanography,Spatial,Mammal,Sm,"
"Community structure and geographic distribution of the coral reefs of nayarit, Mexican Pacific",1997,177,"Habitat,Oceanography,Spatial,Invertebrate,Sm,"
"Marine algal flora of French Polynesia III. Rhodophyta, with additions to the phaeophyceae and chlorophyta",2010,178,"Invasive,Oceanography,Spatial,Algae,Bg,"
Genetic differentiation and secondary contact zone in the seagrass Cymodocea nodosa across the Mediterranean-Atlantic transition region,2008,179,"Genetic,Oceanography,Spatial,Temperature,Historical,Algae,Sm,"
Catch me if you can! The story of a colonial ascidian’s takeover bid in Western Australia,2014,180,"Invasive,Spatial,Bg,Invertebrate,"
Contemporary climate change hinders hybrid performance of ecologically dominant marine invertebrates,2021,181,"Spatial,Invertebrate,Sm,Selection_incompatibility,"
"Molecular phylogeny of the aplodactylidae (Perciformes: Cirrhitoidea), a group of Southern Hemisphere marine fishes",2000,182,"Spatial,Historical,Bg,Fish,"
Intraspecific phylogeography across the point conception biogeographic boundary,1998,183,"Unknown,Genetic,Sm,Mobile_plankton,"
Nearshore fish (Pholis gunnellus) persists across the North Atlantic through multiple glacial episodes,2006,184,"Behavior,Genetic,Spatial,Historical,Bg,Fish,"
Genomic and life-history discontinuity reveals a precinctive lineage for a deep-water grouper with gene flow from tropical to temperate waters on the west coast of Australia,2018,185,"Unknown,Genetic,Fish,Sm,"
Fifteen degrees of separation: Latitudinal gradients of rocky intertidal biota along the California Current,2006,186,"Community,Competition,Habitat,Misc,Oceanography,Temperature,Multiple,Sm,"
Tethyan closure drove tropical marine biodiversity: Vicariant diversification of intertidal crustaceans,2018,187,"Spatial,Historical,Bg,Invertebrate,"
Geographical variation in franciscana (Pontoporia blainvillei) external morphology,2012,188,"Unknown,Spatial,Mammal,Sm,"
"Revision of the cardinalfish subgenus jaydia (perciformes, apogonidae, apogon)",1996,189,"Spatial,Historical,Fish,Sm,"
Shifts between sugar kelp and turf algae in Norway: Regime shifts or fluctuations between different opportunistic seaweed species?,2019,190,"Unknown,Competition,Misc,Spatial,Algae,Sm,"
Completely disjunct mitochondrial DNA haplotype distribution without a phylogeographic break in a planktonic developing gastropod,2008,191,"Unknown,Genetic,Historical,Invertebrate,Sm,"
"Phylogeography of the invasive seaweed Asparagopsis (Bonnemaisoniales, Rhodophyta) reveals cryptic diversity",2007,192,"Invasive,Spatial,Algae,Bg,GSpatial,"
"Planktonic ciliates in different water masses in open waters near Prydz Bay (East Antarctica) during austral summer, with an emphasis on tintinnid assemblages",2018,193,"Community,Oceanography,Spatial,Sm,Mobile_plankton,"
"Hawaiian flying squid Nototodarus hawaiiensis (Cephalopoda: Ommastrephidae) in the Arabian Sea: range extension, age, and growth",2023,194,"Unknown,Spatial,Invertebrate,Sm,"
Latitudinal transects in the southeastern Pacific Ocean reveal a diverse but patchy distribution of phycotoxins,2011,195,"Unknown,Community,Sm,Plankton,"
"Locating faunal breaks in the nearshore fish assemblage of Victoria, Australia",2012,196,"Community,Habitat,Oceanography,Temperature,Fish,Sm,"
Multilocus allozyme differentiation of mussel populations Mytilus galloprovincialis Lmk. from Moroccan coasts,2002,197,"Genetic,Larval_duration,Oceanography,Temperature,Invertebrate,Sm,Selection_incompatibility,"
Genetic structure of the giant kelp Macrocystis pyrifera along the southeastern Pacific,2010,198,"Genetic,Misc,Oceanography,Historical,Algae,Sm,"
Characterization of disjunct populations of Zostera marina (eelgrass) from California: genetic differences resolved by restriction-fragment length polymorphisms,1992,199,"Unknown,Spatial,Algae,Sm,"
Phylogeographic structure in benthic marine invertebrates of the southeast pacific coast of Chile with differing dispersal potential,2014,200,"Genetic,Larval_duration,Historical,Invertebrate,Sm,"
The age and diversification of metacrangonyctid subterranean amphipod crustaceans revisited,2019,201,"Spatial,Historical,Bg,Invertebrate,"
Seaweeds in two oceans: Beta-diversity,2017,202,"Community,Oceanography,Spatial,Historical,Algae,Bg,"
"Patterns of adult abundance vary with recruitment of an invasive barnacle species on Oahu, Hawaii",2015,203,"Habitat,Invasive,Larval_duration,Oceanography,Spatial,Invertebrate,Sm,"
Effect of meteorological and hydrographic disturbances on the microplankton community structure in the Ria de Vigo (NW Spain),2000,204,"Community,Oceanography,Sm,Plankton,"
Supply of gastropod larvae to hydrothermal vents reflects transport from local larval sources,2008,205,"Community,Deep_sea,Larval_duration,Oceanography,Spatial,Invertebrate,Sm,"
"Electrophoretic and biometric variability in the abyssal grenadier Coryphaenoides armatus of the western North Atlantic, eastern South Pacific and eastern North Pacific Oceans",1984,206,"Unknown,Effort,Spatial,Bg,Fish,"
Behaviour in flow: perspectives on the distribution and dispersion of meroplanktonic larvae in the water column,2001,207,"Behavior,Community,Larval_duration,Oceanography,Spatial,Invertebrate,Sm,"
Genetic analyses of rafted macroalgae reveal regional oceanographic connectivity patterns,2015,208,"Genetic,Larval_duration,Oceanography,R,Multiple,Sm,"
The hidden side of a major marine biogeographic boundary: a wide mosaic hybrid zone at the Atlantic–Mediterranean divide reveals the complex interaction between natural and genetic barriers in mussels,2019,209,"Genetic,Oceanography,Invertebrate,Sm,Selection_incompatibility,"
Evolutionary history of the polar regions,1992,210,"Spatial,Bg,Multiple,"
Global biodiversity of the genus Ommastrephes (Ommastrephidae: Cephalopoda): an allopatric cryptic species complex,2020,211,"Effort,Genetic,Spatial,Bg,Invertebrate,"
"Morphological variability, spatial distribution and abundance of Helicostomella species (Ciliophora: Tintinnina) in relation to environmental factors (Argentine shelf; 40-55 degrees S)",2009,212,"Habitat,Oceanography,Spatial,Sm,Mobile_plankton,"
"Genetic and morphological divergence at a biogeographic break in the beach-dwelling brooder Excirolana hirsuticauda Menzies (Crustacea, Peracarida)",2019,213,"Genetic,Habitat,Larval_duration,Oceanography,Invertebrate,Sm,Selection_incompatibility,"
Genetic divergence and larval dispersal in two spider crabs (Crustacea : Decapoda),2000,214,"Unknown,Genetic,Invertebrate,Sm,"
Regional and seasonal characteristics of epipelagic mesozooplankton in the Mediterranean Sea based on an artificial neural network analysis,2014,215,"Community,Habitat,Oceanography,Sm,Plankton,"
Reflections on the ballast water dispersal - harmful algal bloom paradigm,2007,216,"Unknown,Effort,Spatial,Bg,Plankton,"
"Population subdivision in marine environments: the contributions of biogeography, geographical distance and discontinuous habitat to genetic differentiation in a blennioid fish, Axoclinus nigricaudus",2001,217,"Genetic,Spatial,Habitat,Temperature,Fish,Sm,Salinity,"
Surfing the wave on a borrowed board: range expansion and spread of introgressed organellar genomes in the seaweed Fucus ceranoides L.,2010,218,"Genetic,Misc,Historical,Algae,Sm,"
Delineating fish-habitat associations for spatially based management: an example from the south-eastern Australian continental shelf,2001,219,"Community,Habitat,Fish,Sm,"
Seascape genetics of the New Zealand greenshell mussel: sea surface temperature explains macrogeographic scale genetic variation,2013,220,"Genetic,Temperature,Invertebrate,Sm,"
Monorchiids (Platyhelminthes: Digenea) of chaetodontid fishes (Perciformes): Biogeographical patterns in the tropical Indo-West Pacific,2012,221,"Larval_duration,Spatial,Historical,Bg,Invertebrate,"
"Hidden Floridian biodiversity: mitochondrial and nuclear gene trees reveal four cryptic species within the scorched mussel, Brachidontes exustus, species complex",2004,222,"Genetic,Historical,Invertebrate,Sm,"
Maintenance of genetic differentiation across a transition zone in the sea: discordance between nuclear and cytoplasmic markers,2005,223,"Genetic,Historical,Fish,Sm,Selection_incompatibility,"
"EPIFAUNA OF SPONDYLUS-PRINCEPS-UNICOLOR (MOLLUSCA, BIVALVIA) IN PUERTO-ESCONDIDO, GULF OF CALIFORNIA, MEXICO",1993,224,"Community,Habitat,Spatial,Invertebrate,Sm,"
Phylogeography of the snakeskin chiton Sypharochiton pelliserpentis (Mollusca: Polyplacophora) around New Zealand: are seasonal near-shore upwelling events a dynamic barrier to gene flow?,2011,225,"Genetic,Larval_duration,Oceanography,Invertebrate,Sm,"
"Five new species of cotylean flatworms (Platyhelminthes: Polycladida: Cotylea) from Oaxaca, southern Mexican Pacific",2020,226,"Effort,Spatial,Invertebrate,Sm,"
FEEDING ECOLOGY OF THE LOGGERHEAD SEA-TURTLE CARETTA-CARETTA IN THE NORTHWESTERN GULF OF MEXICO,1993,227,"Unknown,Spatial,Other,Sm,"
"NEW SPECIES OF ZYZZYA, CORNULELLA, DAMIRIA, AND ACHELIDERMA (PORIFERA, POECILOSCLERIDA), WITH A REVIEW OF FISTULAR GENERA OF IOPHONIDAE",1994,228,"Unknown,Spatial,Historical,Invertebrate,Sm,"
Matching genetics with oceanography: directional gene flow in a Mediterranean fish species,2011,229,"Genetic,Larval_duration,Oceanography,Fish,Sm,"
"Life-history features and oceanography drive phylogeographic patterns of the chiton Acanthochitona cf. rubrolineata (Lischke, 1873) in the northwestern Pacific",2020,230,"Genetic,Larval_duration,Oceanography,Historical,Invertebrate,Sm,"
Oceanography and ecology of the Aleutian Archipelago: spatial and temporal variation,2005,231,"Unknown,Community,Multiple,Sm,"
Phylogeography of the mud crab (Scylla serrata) in the Indo-West Pacific reappraised from mitochondrial molecular and oceanographic clues: transoceanic dispersal and coastal sequential colonization,2011,232,"Genetic,Spatial,Historical,Bg,Invertebrate,"
"Pleistocene glaciation events shape genetic structure across the range of the American lobster, Homarus americanus",2009,233,"Genetic,Larval_duration,Historical,Invertebrate,Sm,"
Are we ready to track climate-driven shifts in marine species across international boundaries? - A global survey of scientific bottom trawl data,2021,234,"Unknown,Community,Effort,Climate_change,Benthic,Sm,"
The detection of spatial variation in widespread marine species: methods and bias in the analysis of population structure in the crown of thorns starfish (Echinodermata : Asteroidea),2000,235,"Unknown,Genetic,Invertebrate,Sm,"
Contemporary nuclear and mitochondrial genetic clines in a north temperate estuarine fish reflect Pleistocene vicariance,2011,236,"Genetic,Oceanography,Historical,Fish,Sm,"
"Population distribution, connectivity and differentiation of Indo-Pacific humpback dolphins in Chinese waters: Key baselines for improving conservation management",2023,237,"Unknown,Spatial,Mammal,Sm,"
Phylogeographic structure and deep lineage diversification of the red alga Chondrus ocellatus Holmes in the Northwest Pacific,2015,238,"Genetic,Spatial,Historical,Algae,Sm,Selection_incompatibility,"
Features of the distribution of benthic tropical groups in the Laptev Sea,1998,239,"Community,Habitat,Spatial,Benthic,Sm,"
The cryptic and the apparent reversed: lack of genetic differentiation within the morphologically diverse plexus of the planktonic foraminifer Globigerinoides sacculifer,2013,240,"Misc,Spatial,Historical,Bg,GSpatial,Plankton,"
Spatial and temporal patterns in larval supply at hydrothermal vents in the northeast Pacific Ocean,2004,241,"Community,Deep_sea,Larval_duration,Oceanography,Spatial,Historical,Invertebrate,Sm,"
"First record of the recently described Korean bryozoan Primavelans glabricollaris Min, Chae, Yang, Noh, Lee & Seo, 2021 (Cheilostomatida: Pacificincolidae) from the North-east Atlantic",2022,242,"Habitat,Invasive,Spatial,Invertebrate,Sm,"
"Ecological relevance of laboratory determined temperature limits: colonization potential, biogeography and resilience of Antarctic invertebrates to environmental change",2010,243,"Larval_duration,Spatial,Temperature,Climate_change,Invertebrate,Sm,"
Species delimitation and mitogenome phylogenetics in the subterranean genus Pseudoniphargus (Crustacea: Amphipoda),2018,244,"Genetic,Spatial,Historical,Bg,Invertebrate,"
"Records of the gadoid fish Arctogadus glacialis (Peters, 1874) in the European Arctic",2009,245,"Unknown,Spatial,Fish,Sm,"
What is natural? The scale of cryptogenesis in the North Atlantic Ocean,2012,246,"Invasive,Spatial,Bg,Multiple,"
An analytically derived delineation of the West African Coastal Province based on bivalves,2022,247,"Unknown,Habitat,Spatial,Invertebrate,Sm,"
Ancient divergences and recent connections in two tropical Atlantic reef fishes Epinephelus adscensionis and Rypticus saponaceous (Percoidei : Serranidae),2003,248,"Genetic,Spatial,Historical,Bg,Fish,"
Alien Decapod Crustaceans in the Southwestern Atlantic Ocean,2011,249,"Effort,Invasive,Spatial,Invertebrate,Sm,"
"Restoration of the taxon Lycodes marisalbi, with notes on its disjunct Arctic distribution",2000,250,"Unknown,Spatial,Fish,Sm,"
"Distribution patterns and habitat suitability of the non-native brittle star Ophiothela mirabilis Verrill, 1867 along the Western Atlantic",2021,251,"Habitat,Invasive,Spatial,Bg,Invertebrate,"
Distribution of a Coastal Delphinid Under the Impact of Long-Term Habitat Loss: Indo-Pacific Humpback Dolphins off Taiwan's West Coast,2017,252,"Habitat,Spatial,Climate_change,Mammal,Sm,"
Genetic discontinuities in a dominant mangrove Rhizophora apiculata (Rhizophoraceae) in the Indo-Malesian region,2016,253,"Genetic,Oceanography,Historical,Algae,Sm,"
Invasion genetics of the Ciona intestinalis species complex: from regional endemism to global homogeneity,2010,254,"Invasive,Spatial,Bg,GSpatial,Invertebrate,"
Missing in the Middle: A Review of Equatorially Disjunct Marine Taxa,2021,255,"Competition,Misc,Spatial,Historical,Bg,Multiple,"
Introduced and native populations of a marine parasitic castrator: Variation in prevalence of the rhizocephalan Loxothylacus panopaei in xanthid crabs,1997,256,"Invasive,Spatial,Other,Sm,"
Genomic mechanisms of evolved physiological plasticity in killifish distributed along an environmental salinity gradient,2011,257,"Misc,Fish,Sm,Salinity,"
Congruence between fine-scale genetic breaks and dispersal potential in an estuarine seaweed across multiple transition zones,2020,258,"Genetic,Oceanography,Historical,Algae,Sm,"
Species replacement along a linear coastal habitat: phylogeography and speciation in the red alga Mazzaella laminarioides along the south east pacific,2012,259,"Genetic,Habitat,Historical,Algae,Sm,"
"TAXONOMY AND GEOGRAPHIC-VARIATION OF PYURA-MICROCOSMUS (SAVIGNY) FROM LUSITANIAN WATERS AND THE RED-SEA (UROCHORDATA, ASCIDIACEA)",1993,260,"Unknown,Spatial,Historical,Invertebrate,Sm,"
Reproductive strategies and population genetic structure of Fucus spp. across a northeast Atlantic biogeographic transition,2017,261,"Genetic,Larval_duration,Oceanography,Algae,Sm,"
"The Indo-Pacific nudibranch Baeolidia moebii Bergh, 1888 in Greece, with the first documented spawning aggregation in the Mediterranean Sea",2022,262,"Unknown,Effort,Spatial,Bg,Invertebrate,"
Comparison of population-genetic structuring in congeneric kelp- versus rock-associated snails: a test of a dispersal-by-rafting hypothesis,2011,263,"Genetic,Habitat,R,Invertebrate,Sm,"
Some Aspects of the Walleye Pollock (Theragra chalcogramma) Biology and Fishery Related to the Size and Age Structure in the Southwestern Chukchi Sea,2022,264,"Behavior,Habitat,Spatial,Fish,Sm,"
"Predicting consequences of climate change for ecosystem functioning: variation across trophic levels, species and individuals",2015,265,"Competition,Misc,Spatial,Temperature,Multiple,Sm,"
"Record of Bodianus rubrisos Gomon, 2006 from the northern Red Sea, previously misidentified as B. leucosticticus (non Bennett) or B. trilineatus (non Fowler) (Labridae)",2016,266,"Unknown,Deep_sea,Effort,Spatial,Bg,Fish,"
"Population structure, gene flow, and historical demography of a small coastal shark (Carcharhinus isodon) in US waters of the Western Atlantic Ocean",2016,267,"Behavior,Genetic,Habitat,Historical,Fish,Sm,"
"Oceanic islands and seamounts as staging posts for Copepoda Harpacticoida (Crustacea) - Shallow-water Paramesochridae Lang, 1944 from the North-East Atlantic Ocean, including the (re-)description of three species and one subspecies from the Madeiran Archipelago",2015,268,"Effort,Spatial,Bg,Mobile_plankton,"
"Recent changes in the distribution of a marine gastropod, Patella rustica Linnaeus, 1758, and their relationship to unusual climatic events",2006,269,"Oceanography,Spatial,Temperature,Climate_change,Invertebrate,Sm,"
"The predatory Atlantic red drum, Sciaenops ocellatus, has invaded the western Taiwanese coast in the Indo-West Pacific",2010,270,"Invasive,Spatial,Bg,Fish,"
Population genetic consequences of larval dispersal mode and hydrography: a case study with bryozoans,2001,271,"Genetic,Larval_duration,Oceanography,Invertebrate,Sm,"
Inferring potential barriers to gene flow in tropical populations of Avicennia germinans,2020,272,"Genetic,Oceanography,Algae,Sm,"
"Marine biogeographical disjunction in temperate Australia: historical landbridge, contemporary currents, or both?",2008,273,"Genetic,Oceanography,Spatial,Historical,Invertebrate,Sm,Selection_incompatibility,"
Modeling the spatial and temporal population dynamics of the copepod Centropages typicus in the northwestern Mediterranean Sea during the year 2001 using a 3D ecosystem model,2014,274,"Oceanography,Spatial,Sm,Mobile_plankton,"
"Demographic history, not larval dispersal potential, explains differences in population structure of two New Zealand intertidal species",2021,275,"Genetic,Historical,Invertebrate,Sm,"
Marine landscape shapes hybrid zone in a broadcast spawning bivalve: introgression and genetic structure in Canadian west coast Mytilus,2010,276,"Genetic,Oceanography,Invertebrate,Sm,Selection_incompatibility,"
Patterns of extensive genetic differentiation and variation among European harbor seals (Phoca vitulina vitulina) revealed using microsatellite DNA polymorphisms,1998,277,"Behavior,Genetic,Habitat,Spatial,Historical,Mammal,Sm,"
"Morphological and molecular evidences within Osmundea (Ceramiales, Rhodophyta) from the Canary Islands, eastern Atlantic Ocean",2012,278,"Unknown,Spatial,Algae,Sm,"
Distribution of angel sharks (Squatinidae) in United States waters of the western North Atlantic Ocean,2018,279,"Oceanography,Spatial,Temperature,Fish,Sm,Salinity,"
"Divergence and zoogeography of mole crabs, Emerita spp (Decapoda: Hippidae), in the Americas",1996,280,"Genetic,Spatial,Historical,Bg,Invertebrate,"
"Lineage splitting, secondary contacts and genetic admixture of a widely distributed marine invertebrate",2017,281,"Genetic,Historical,Invertebrate,Sm,"
Insights on stock structure of round sardinella Sardinella aurita off north-west Africa based on otolith shape analysis,2016,282,"Genetic,Oceanography,Fish,Sm,"
Geographic distribution and predation of Porites lobata (Anthozoa : Scleractinia) along the western Mexican coast,1999,283,"Larval_duration,Oceanography,Spatial,Invertebrate,Sm,"
"Reassessment of the franciscana Pontoporia blainvillei (Gervais & d'Orbigny, 1844) distribution and niche characteristics in Brazil",2018,284,"Competition,Habitat,Misc,Spatial,Mammal,Sm,"
Long-distance island hopping without dispersal stages: transportation across major zoogeographic barriers in a Southern Ocean isopod,2010,285,"Deep_sea,Genetic,Oceanography,Spatial,Bg,Invertebrate,"
"First report of Reticulocaulis mucosissimus (Naccariaceae, rhodophyta) for the Atlantic Ocean",2006,286,"Effort,Spatial,Algae,Bg,"
"Molecular systematics of the 'Navanax aenigmaticus' species complex (Mollusca, Cephalaspidea): coming full circle",2012,287,"Genetic,Spatial,Bg,Invertebrate,"
The distribution of hydroid sibling species estuaries in the Gulf of Maine,1998,288,"Larval_duration,Spatial,Historical,Invertebrate,Sm,"
THERMAL ECOTYPES OF AMPHI-ATLANTIC ALGAE .2. COLD-TEMPERATE SPECIES (FURCELLARIA-LUMBRICALIS AND POLYIDES-ROTUNDUS),1990,289,"Spatial,Historical,Algae,Bg,"
Latitudinal regionalization of epibenthic macroinvertebrate communities on rocky reefs in the Gulf of California,2016,290,"Community,Oceanography,Benthic,Sm,"
"Placing the Floridian marine genetic disjunction into a regional evolutionary context using the scorched mussel, Brachidontes exustus, species complex",2005,291,"Competition,Genetic,Oceanography,Historical,Invertebrate,Sm,"
Historical Biogeography of Delphininae Dolphins and Related Taxa (Artiodactyla: Delphinidae),2018,292,"Genetic,Oceanography,Spatial,Historical,Bg,Mammal,"
"PATTERNS OF GENE FLOW AND GENETIC-DIVERGENCE IN THE NORTHEASTERN PACIFIC CLINIDAE (TELEOSTEI, BLENNIOIDEI), BASED ON ALLOZYME AND MORPHOLOGICAL DATA",1991,293,"Oceanography,Spatial,Fish,GSpatial,Sm,"
